TYPE,COUNTRY,CODE_SHARE,CODE_ORG,ORGANISATION,DESCRIPTION,UOM,QUANTITY,STATUS,DATE100,KENYA,bednet,XBN/4,Oxfam GB,Bale of 75 Impregnated Bednets,Bale,50,Stock,100,KENYA,bucket,TWC/2,Oxfam GB,Oxfam Bucket,Each,1000,Stock,100,KENYA,sheeting,SPE/4,Oxfam GB,Reinforced Woven Plastic Sheeting (rolls),Each,25,Stock,100,KENYA,tent,ASTDD/4,Oxfam GB,"Tent, Double Dome for mixed Conditions",Each,1000,Planned Purchase,12/10/2011100,KENYA,tent,ASTDD/4,Oxfam GB,"Tent, Double Dome for mixed Conditions",Each,100,Stock,